{"target_sku":"MA-SKL-000013","target_version":"1.0.0","from_level":2,"to_level":3,"requested_at":"2026-07-23T23:59:59-05:00","evidence":["EV-20260723-0174"],"quality_gate":{"structural_validation":true,"behavioral_validation":false,"critical_failures":0},"approvals":[],"decision":"changes-required"}
