{
  "target_sku": "AA-SKL-000208",
  "target_version": "1.0.0",
  "from_level": 1,
  "to_level": 2,
  "requested_at": "2026-08-09T12:00:00-05:00",
  "evidence": [
    "EV-20260805-GPT-VISUAL-001"
  ],
  "quality_gate": {
    "structural_validation": true,
    "behavioral_validation": false,
    "critical_failures": 0
  },
  "approvals": [],
  "decision": "changes-required"
}
