{
  "target_sku": "CO-SKL-000005",
  "target_version": "1.0.0",
  "from_level": 2,
  "to_level": 3,
  "requested_at": "2026-08-17T00:00:00-05:00",
  "evidence": [
    "EV-20260817-CO-SKL-000005"
  ],
  "quality_gate": {
    "structural_validation": true,
    "behavioral_validation": false,
    "critical_failures": 0
  },
  "approvals": [],
  "decision": "changes-required"
}
